{
  "submissionId": "00000000-0000-4000-8000-000000000001",
  "source": "web-experiencia-ritual-40",
  "formVersion": "2026-08-31",
  "nombre": "Persona de ejemplo",
  "email": "cliente@example.com",
  "celular": "",
  "ciudad": "Ciudad de ejemplo",
  "direccion": "",
  "mensaje": "Esta es una experiencia ficticia para documentar el contrato de integración.",
  "experiencia": "Esta es una experiencia ficticia para documentar el contrato de integración.",
  "consentimiento": true,
  "autorizacionTestimonio": false,
  "politicaDatosVersion": "2026-08-31",
  "ebook": "Ritual 40+",
  "ebookRequested": true,
  "ebookPath": "/downloads/ebook-ritual-40.pdf",
  "ebookUrl": "https://cuarentamas.com/downloads/ebook-ritual-40.pdf",
  "contactEmail": "contacto@cuarentamas.com",
  "submittedAt": "2026-09-02T12:00:00.000Z",
  "pageUrl": "https://cuarentamas.com/comparte-tu-experiencia",
  "userAgent": "Ejemplo documental; no corresponde a una persona real",
  "ip": "192.0.2.1"
}
